{"$schema":"https://json-schema.org/draft/2020-12/schema","$id":"topic.schema.json","type":"object","additionalProperties":false,"required":["id","name","shortDescription","hooks","coreConceptIds","testRubricId","contentPoolVersion"],"properties":{"id":{"type":"string","minLength":1,"maxLength":128},"name":{"type":"string","minLength":1,"maxLength":160},"shortDescription":{"type":"string","minLength":1,"maxLength":800},"hooks":{"type":"array","items":{"type":"string","minLength":1,"maxLength":240},"maxItems":50,"uniqueItems":true},"coreConceptIds":{"type":"array","items":{"type":"string","minLength":1,"maxLength":128},"maxItems":500,"uniqueItems":true},"testRubricId":{"type":"string","minLength":1,"maxLength":128},"contentPoolVersion":{"type":"string","minLength":1,"maxLength":64}}}
