[
  {
    "id": "ai-agents-future-work",
    "name": "AI agents & future work",
    "shortDescription": "How AI agents may reshape work, organizations, and human roles.",
    "hooks": [
      "To thrive in emerging labor markets, AI agents must transcend brittle scaffolding by mastering metacognitive self-assessment and strategic reasoning to navigate persistent economic frictions.",
      "UpBench evaluates AI agent competence using real-world tasks from a freelance marketplace, grounding agent assessment in verifiable financial transactions and professional rubrics.",
      "New research suggests that agentic AI, by executing end-to-end workflows rather than isolated tasks, creates a broad risk profile that prompts a re-evaluation of how we measure occupational displacement.",
      "A multi-agent LLM framework, utilizing role-based coordination, offers a promising but competitively complex approach to automating inquiries about Brazil's Consolidation of Labor Laws (CLT).",
      "New economic research suggests that AI agents do not drive labor wages to zero via infinite supply, but instead anchor them to the finite, often fluctuating costs of compute infrastructure.",
      "Expert forecasts on AI-driven job displacement diverge into three distinct camps—alarmed, patient, and excited—each offering fundamentally different predictions about the economic trajectory of the next decade.",
      "Rather than fully automating roles, AI agents are shifting the future of work toward human-supervised, goal-directed workflows.",
      "Researchers introduce an 'observed exposure' metric that tracks how real-world AI usage in professional settings aligns with theoretical task automation potential.",
      "OpenAI cofounder Andrej Karpathy suggests that fully functional AI agents remain a decade away, highlighting significant gaps in current model capabilities.",
      "Unlike traditional generative AI, agentic AI actively plans and executes tasks, requiring a fundamental redesign of business operating models to sustain competitive advantage.",
      "New research shows that while employees are rapidly adopting AI, the primary barrier to value creation is a 'Transformation Paradox' where organizational systems fail to support individual initiative.",
      "One panelist claimed that 95% of AI agent deployments fail in production, attributing these failures not to model intelligence but to a lack of robust scaffolding in context, memory, and security.",
      "An open forum discussion poses questions regarding the ultimate impact and viability of autonomous AI agents.",
      "A software engineer with 15 years of industry experience questions whether companies are truly operating via autonomous AI agent ecosystems or if such claims are largely marketing hype.",
      "A graduate student in AI research questions whether AI agents are driving significant workforce displacement or if adoption remains limited to productivity enhancements.",
      "A forum user is initiating a discussion on the practical, real-world utility of AI agents within large organizations over the next three years.",
      "A social media discussion prompts a critical look at the trajectory of AI agents, questioning whether the trend toward full autonomy will ultimately be met with a user-led push for increased control.",
      "A prospective graduate student inquires whether academic AI research groups utilize established agent frameworks or favor bespoke, custom-built implementations.",
      "A pseudonymous software engineer questions the strategic mandate for agentic AI adoption when actual code writing occupies only a fraction of daily engineering work.",
      "A Reddit post authored by jholliday55 proposes four potential scenarios for the evolution of software engineering as AI capabilities advance over the next five years.",
      "A Reddit user argues that software engineers are not the victims of AI-driven job displacement, but rather the primary drivers of industry transformation.",
      "A software engineer reflects on a recent interview experience, questioning how traditional platform skill sets align with emerging expectations for AI-specific infrastructure.",
      "A self-described veteran AI engineer reports that the rapid automation of coding tasks is fundamentally transforming their role, leading to burnout and a planned career pivot.",
      "A 42-year-old digital marketing professional expresses personal concern regarding the long-term impact of artificial intelligence on job security.",
      "A user-submitted anecdote describes an agent designed to assist debugging by linking Slack alerts to GitHub context and suggesting code fixes.",
      "Data presented by a Stanford economist indicates an observed association between high AI exposure and slower employment growth for early-career workers.",
      "The video argues that for many employees, integrating AI agents into workflows has increased total workload due to the necessity for extensive error correction and oversight, contrary to the promise of increased productivity.",
      "A software engineer with over 25 years of industry experience provides a technical perspective on the evolution of AI agents and their impact on complex, multi-step work.",
      "Agentic AI systems move beyond basic conversational chatbots by demonstrating autonomy, multi-step planning, and tool integration to achieve complex goals.",
      "As AI agents gain the capability to function autonomously without human intervention, developing systematic evaluation frameworks is critical for their safe and effective deployment.",
      "Nvidia CEO Jensen Huang discusses a future model for medicine where AI agents autonomously orchestrate research and robotic laboratory workflows.",
      "Post-Labor Economics proposes that as AI and automation alter the link between GDP and human labor, institutions should convert productivity surpluses into broad, property-based income streams to maintain shared prosperity.",
      "Adding more AI agents to your existing workflows doesn't inherently make them smarter; it often increases cost and system failure risk.",
      "As 'agentic' AI becomes more integrated into business workflows, experts weigh the potential for increased automation against the enduring value of human expertise.",
      "Bernard Marr explains in the video that agentic AI, which operates with autonomous planning and reasoning, may transform the workforce landscape rather than causing widespread unemployment.",
      "AI agents are transforming how researchers work by shifting from simple Q&A interfaces to active, multi-step collaborators.",
      "This video breaks down the evolution of AI from simple chatbots to autonomous agents using a clear, three-level framework.",
      "As autonomous AI agents continue to develop, understanding their diverse architectural classifications—from reactive systems to complex learners—is vital for assessing their practical application.",
      "Participants discuss whether the current hype surrounding 'AI agents' is grounded in technical reality or marketing overstatement.",
      "Contrary to the fear that AI agents will render Software-as-a-Service obsolete, these tools are emerging as powerful enhancements that integrate into existing workflows.",
      "As artificial intelligence capabilities evolve from simple chatbots to autonomous agents, Jay Kiew suggests that the nature of professional work may be shifting toward AI orchestration.",
      "The video argues that AI agents are transforming productivity by autonomously executing multi-step business goals, potentially allowing them to perform tasks while human workers are off the clock.",
      "Traditional AI chatbots are evolving into autonomous agents that can complete complex tasks, not just provide answers.",
      "AI agents are evolving beyond basic automation, functioning more like autonomous teammates capable of reasoning through complex, unseen tasks.",
      "Robert Smith explains how AI-empowered 'agentic' enterprise software is poised to drive unprecedented growth and productivity, distinguishing it from consumer-focused foundational models.",
      "Eric Pritchett, President/COO of Terzo, outlines a framework for integrating AI agents and orchestration platforms into complex business automation workflows.",
      "As artificial intelligence adoption accelerates, establishing robust governance frameworks is becoming a critical strategy for managing the associated operational and ethical risks.",
      "Architects must evolve their governance models for AI agents, as these entities require more nuanced observability than traditional microservices.",
      "AI agents offer significant productivity gains but introduce new attack vectors that necessitate a robust, security-focused architecture.",
      "As AI transitions from simple task execution to autonomous goal achievement, Heather McGowan outlines how human labor must shift toward strategy and ethical oversight."
    ],
    "coreConceptIds": [
      "concept-0171abdb5ca74b29a4b2",
      "concept-03e942734f24318ef1b1",
      "concept-042ec5df065def89a634",
      "concept-04ff9e8cfbec03ce908f",
      "concept-058b3ef1740aa3c22102",
      "concept-066ebb84473b4eb7c990",
      "concept-069bce3deb26e52aed97",
      "concept-08156dbe9ff50d54aaef",
      "concept-081654cb6a9c142ff991",
      "concept-083f7d4ed19eb1dee590",
      "concept-084a7942fbbec6506b91",
      "concept-092e855bb196ff23371f",
      "concept-0ab37c8e4a2ef4607964",
      "concept-0ac7518c1fa1e9c3f13c",
      "concept-0af7f536dd9112c7159b",
      "concept-0b022444d43e9919f4af",
      "concept-0c7d337a1546a9a8f555",
      "concept-0c93859ffb25b69df552",
      "concept-0ca36a73b0828a465e70",
      "concept-0d4cf6ad9a4f3d071dd3",
      "concept-0dc8449029c5ecd5fee4",
      "concept-0e28bc1a68759103bb3c",
      "concept-0edcc8fa21fb74861a49",
      "concept-10c3473eccac75c8ee2a",